{
  "ai_origin_policy_schema_version": 3,
  "entries": [
    {
      "origin_id": "ai-coverage-v1-city-bulky-waste-quantity",
      "origin_kind": "coverage_candidate",
      "scenario_key": "시청:대형폐기물 배출",
      "text_fingerprint": "9d647f28114deb138cd73a7d20341b113ba7c466d4ae3d3891cc1bd4b7d8f3a5"
    },
    {
      "origin_id": "ai-coverage-v1-city-certificate-issuance-channel",
      "origin_kind": "coverage_candidate",
      "scenario_key": "시청:주민등록 등본 문의",
      "text_fingerprint": "e5fc70aaa5ee5a66a22580114ffcbc3e1ec51074f9df608cab9224169ba04f95"
    },
    {
      "origin_id": "ai-coverage-v1-city-passport-applicant-type",
      "origin_kind": "coverage_candidate",
      "scenario_key": "시청:여권 발급 문의",
      "text_fingerprint": "9cd546de8a128be3d005ec6329f1b950a7f2869be69c785250f0d4317eb486b4"
    },
    {
      "origin_id": "ai-coverage-v1-city-passport-application-channel",
      "origin_kind": "coverage_candidate",
      "scenario_key": "시청:여권 발급 문의",
      "text_fingerprint": "c11dc61aba02d3b3a580c5dd7b2e08552dcf62b07dbda0b7e3a2bff8f5b5857b"
    },
    {
      "origin_id": "ai-coverage-v1-city-passport-application-type",
      "origin_kind": "coverage_candidate",
      "scenario_key": "시청:여권 발급 문의",
      "text_fingerprint": "d3c96e270655c73fd8ab272d94dda94bd529324b4c2ac9a1493583cd68c4572d"
    },
    {
      "origin_id": "ai-coverage-v1-delivery-change-unavailable-preference",
      "origin_kind": "coverage_candidate",
      "scenario_key": "배달:주문 변경",
      "text_fingerprint": "71fae814daeecb8e58e5e2e8016625159e429d95bdfd28302c738717f783fd51"
    },
    {
      "origin_id": "ai-coverage-v1-delivery-delay-delay-detail",
      "origin_kind": "coverage_candidate",
      "scenario_key": "배달:배달 지연 문의",
      "text_fingerprint": "981d538be8821883089e377259df54271ade8ec88ce69cc6f94264b848fdff1f"
    },
    {
      "origin_id": "ai-coverage-v1-delivery-delay-delay-resolution",
      "origin_kind": "coverage_candidate",
      "scenario_key": "배달:배달 지연 문의",
      "text_fingerprint": "c7ace84a032c4c14b099c4081084b5e9ff8541f3590b3c8279ccc62dcb1bfcc7"
    },
    {
      "origin_id": "ai-coverage-v1-delivery-refund-evidence-status",
      "origin_kind": "coverage_candidate",
      "scenario_key": "배달:환불/재배달 문의",
      "text_fingerprint": "481a98927022789c155cc16d413937d398a5fa1c3fe127d1fa90d93106c0a731"
    },
    {
      "origin_id": "ai-coverage-v1-delivery-refund-order-number",
      "origin_kind": "coverage_candidate",
      "scenario_key": "배달:환불/재배달 문의",
      "text_fingerprint": "b45e3b784a6b5cf5a17007ef21bbbb34482bd56ff97326a48ebecfc55685fc52"
    },
    {
      "origin_id": "ai-coverage-v1-delivery-refund-resolution-preference",
      "origin_kind": "coverage_candidate",
      "scenario_key": "배달:환불/재배달 문의",
      "text_fingerprint": "767a3f51deaf7f0a672347e7602a6a19e11e35a463b0c48362f71f64b4a3fb60"
    },
    {
      "origin_id": "ai-coverage-v1-reservation-hair-salon-selected-time",
      "origin_kind": "coverage_candidate",
      "scenario_key": "예약:미용실 예약",
      "text_fingerprint": "e8c858e78a4057ebd5a9ea12a6d92f1c33d3b02d658fa8a582aee309c174ab90"
    },
    {
      "origin_id": "ai-coverage-v1-reservation-hospital-selected-time",
      "origin_kind": "coverage_candidate",
      "scenario_key": "예약:병원 예약",
      "text_fingerprint": "9e1a10ff74cbfe705a7653021b67e828c8386bf5b46d7eed51a901dfc8e76420"
    },
    {
      "origin_id": "ai-coverage-v1-reservation-restaurant-selected-time",
      "origin_kind": "coverage_candidate",
      "scenario_key": "예약:식당 예약",
      "text_fingerprint": "4e6a84eb78b19563a381d589431abcd3c2c336ae989e3869d40e4412197fe60b"
    },
    {
      "origin_id": "ai-coverage-v1-reservation-study-room-selected-time",
      "origin_kind": "coverage_candidate",
      "scenario_key": "예약:스터디룸 예약",
      "text_fingerprint": "bf6615d96c04419f1d8828521004b51b9e0780654bd29966edba36ec55e452dd"
    },
    {
      "origin_id": "ai-coverage-v1-support-network-occurred-at",
      "origin_kind": "coverage_candidate",
      "scenario_key": "고객센터:인터넷/통화 문제 문의",
      "text_fingerprint": "2feb8ee6c09e5d89bdbce87067eba05370614705af3b1e64185da21b9d74428e"
    },
    {
      "origin_id": "ai-coverage-v1-support-network-scope",
      "origin_kind": "coverage_candidate",
      "scenario_key": "고객센터:인터넷/통화 문제 문의",
      "text_fingerprint": "009d1f157efab5f32583c5691a173e8579c8ccb50932a654c8801a9713b35ab4"
    },
    {
      "origin_id": "ai-coverage-v1-support-network-service-type",
      "origin_kind": "coverage_candidate",
      "scenario_key": "고객센터:인터넷/통화 문제 문의",
      "text_fingerprint": "b21132cf22dde225524e9a6fb5aaee0bb69e83ca3443a57c9f83e45bd87bdcd3"
    },
    {
      "origin_id": "ai-coverage-v1-support-network-troubleshooting-done",
      "origin_kind": "coverage_candidate",
      "scenario_key": "고객센터:인터넷/통화 문제 문의",
      "text_fingerprint": "d2273970e5f03153c522aa5967479c8af90fdb5a1854d9e9903a28e16b230255"
    },
    {
      "origin_id": "ai-coverage-v1-support-plan-consent-scope",
      "origin_kind": "coverage_candidate",
      "scenario_key": "고객센터:요금/약정 상담",
      "text_fingerprint": "7622435148c674f7bd60c6a212666ba80bf830ce212de0ed99974395baf7fd8e"
    },
    {
      "origin_id": "ai-coverage-v1-support-service-model-name",
      "origin_kind": "coverage_candidate",
      "scenario_key": "고객센터:a/s 접수",
      "text_fingerprint": "98a7ef9a303c10e97fd41d746147d40c4b5abf1a274dd751d7c0c2e3466ad972"
    },
    {
      "origin_id": "ai-coverage-v1-support-service-occurred-at",
      "origin_kind": "coverage_candidate",
      "scenario_key": "고객센터:a/s 접수",
      "text_fingerprint": "397b85c2d6b4393821efca5f47ac4464804c902316eeb095af0febaf9754c2f3"
    },
    {
      "origin_id": "ai-coverage-v1-support-service-safety-status",
      "origin_kind": "coverage_candidate",
      "scenario_key": "고객센터:a/s 접수",
      "text_fingerprint": "f39ee3f0b324160d7db59260ed3d9b0dbc6d0077297e24509a4bc7e744a3c02b"
    },
    {
      "origin_id": "ai-coverage-v1-support-service-service-channel",
      "origin_kind": "coverage_candidate",
      "scenario_key": "고객센터:a/s 접수",
      "text_fingerprint": "8f2a155943b2f4bdb4a2bbc22f7f4be4b37c0608d1585ded1f80460cfd0288dc"
    },
    {
      "origin_id": "ai-coverage-v2-city-bulky-waste-quantity-clear",
      "origin_kind": "coverage_candidate_batch_002",
      "scenario_key": "시청:대형폐기물 배출",
      "text_fingerprint": "f9b819a6d4b2a3eeba713c061ce54c50f6f689bf5fdb0e4f5fd1374573953b87"
    },
    {
      "origin_id": "ai-coverage-v2-city-certificate-issuance-channel-clear",
      "origin_kind": "coverage_candidate_batch_002",
      "scenario_key": "시청:주민등록 등본 문의",
      "text_fingerprint": "26795e61691492ffc150ee17f182559d5766541c754c0b27a16a66f0cfb747cd"
    },
    {
      "origin_id": "ai-coverage-v2-delivery-change-unavailable-preference-clear",
      "origin_kind": "coverage_candidate_batch_002",
      "scenario_key": "배달:주문 변경",
      "text_fingerprint": "97c6dd1877565a6f651b83bafd02dd85c11c0b95cc8c2d5f52d3602552a31652"
    },
    {
      "origin_id": "ai-coverage-v2-support-plan-consent-scope-clear",
      "origin_kind": "coverage_candidate_batch_002",
      "scenario_key": "고객센터:요금/약정 상담",
      "text_fingerprint": "35a42da4808abb5bc15149a6777fd384e0e6856789bb22e8eb9503112103cf9d"
    },
    {
      "origin_id": "ai-seed-city-bulky-waste",
      "origin_kind": "bootstrap_seed",
      "scenario_key": "시청:대형폐기물 배출",
      "text_fingerprint": "60624453726aedd60adebd4467d987d5cdadfd58bbc759c23767ad39dfc99b0d"
    },
    {
      "origin_id": "ai-seed-city-certificate",
      "origin_kind": "bootstrap_seed",
      "scenario_key": "시청:주민등록 등본 문의",
      "text_fingerprint": "2722314fd2d37e11c4c3db4e82daf8ed8ce22d3a39f8d57b17af56752e20254e"
    },
    {
      "origin_id": "ai-seed-city-passport",
      "origin_kind": "bootstrap_seed",
      "scenario_key": "시청:여권 발급 문의",
      "text_fingerprint": "e1002d4cbca89dd820ff9576758e84ab8ff40c651615a5126529cd0fcfc25f06"
    },
    {
      "origin_id": "ai-seed-delivery-change",
      "origin_kind": "bootstrap_seed",
      "scenario_key": "배달:주문 변경",
      "text_fingerprint": "2ad418a1466ed90173397e7e459e03189ef35c7eec452f633368c8b1739c964b"
    },
    {
      "origin_id": "ai-seed-delivery-delay",
      "origin_kind": "bootstrap_seed",
      "scenario_key": "배달:배달 지연 문의",
      "text_fingerprint": "870bba587f2f5aac20f9aedeefe2a6aa2232446426489448c24bc30214058a80"
    },
    {
      "origin_id": "ai-seed-delivery-refund",
      "origin_kind": "bootstrap_seed",
      "scenario_key": "배달:환불/재배달 문의",
      "text_fingerprint": "44c48850b43c8f67a2d5e283d687d90f033316382b455a50b935c70f476369c4"
    },
    {
      "origin_id": "ai-seed-hair-salon",
      "origin_kind": "bootstrap_seed",
      "scenario_key": "예약:미용실 예약",
      "text_fingerprint": "1e159ac48a8d349a9b7af1176922964e621bb2130eda4d9514ae0e9e416068d3"
    },
    {
      "origin_id": "ai-seed-hospital",
      "origin_kind": "bootstrap_seed",
      "scenario_key": "예약:병원 예약",
      "text_fingerprint": "b7286631a1f92f1eb318ea5e2d6f9bfc983fd6f92ebd517c282c6d3e36f9afa8"
    },
    {
      "origin_id": "ai-seed-professor-absence",
      "origin_kind": "bootstrap_seed",
      "scenario_key": "교수님:결석 사유 전달",
      "text_fingerprint": "196c8d1de3f59a5fb48974e70d1c44cee44096f494e93149c4377054713c6c3a"
    },
    {
      "origin_id": "ai-seed-professor-appointment",
      "origin_kind": "bootstrap_seed",
      "scenario_key": "교수님:면담 예약",
      "text_fingerprint": "de6eebd1351d4e61185149a4a06b78f29084850f16e0a6d5e8d3537919e9a1d9"
    },
    {
      "origin_id": "ai-seed-professor-assignment",
      "origin_kind": "bootstrap_seed",
      "scenario_key": "교수님:과제 문의",
      "text_fingerprint": "fd11425fd2983a783466314b57db1d21d8bde2914560a7a9e714098e64c6f6fe"
    },
    {
      "origin_id": "ai-seed-restaurant",
      "origin_kind": "bootstrap_seed",
      "scenario_key": "예약:식당 예약",
      "text_fingerprint": "dfa5d059302dfc4d682ed1a9539b402561c0ac500460e6fad2e5abbe61c4ae38"
    },
    {